,locus_tag,old_locus_tag,OctoberProduct,SAdLSApdb,SAdLSApreTMS,SAdLSApreTMS2,SAdLSApdbDescription,pfamID,pfamPreTMS,pfamPreTMS2,pfamDescription,hhblitsID,hhblitsProb,hhblitsDescription
WP_010939819.1,DVU_RS11920,DVU2549,hypothetical,6UMM_A,0.5323,0.2252,"ESX-3 secretion system protein EccE3; ESX, secretion system, type VII;{Mycobacterium smegmatis (strain ATCC 700084 / mc(2)155)}",PF17680.2,0.5381,0.4114,FlgO ; FlgO protein,5CFI_A,68.36,"Ap4A hydrolase (E.C.3.6.1.17); Ap4A, Nudix hydrolyse, Plasmodium, Purinergic; 2.6A {Plasmodium falciparum (isolate 3D7)}"
WP_010939826.1,DVU_RS11950,DVU2556,hypothetical,5CEG_C,0.4820,0.5937,"Addiction module antidote protein, CopG/Arc/MetJ; Toxin Anti-toxin, TOXIN; HET: GOL; 1.59A {Mesorhizobium opportunistum (strain LMG 24607 / HAMBI 3007 / WSM2075)}",PF03693.15,0.4681,0.6528,ParD_antitoxin ; Bacterial antitoxin of ParD toxin-antitoxin type II system and RHH,1EA4_F,90.10,"TRANSCRIPTIONAL REPRESSOR COPG; TRANSCRIPTIONAL REPRESSOR, DNA-BINDING PROTEIN, PLASMID; 2.95A {STREPTOCOCCUS AGALACTIAE} SCOP: a.43.1.3"
WP_014524530.1,DVU_RS11990,NULL,hypothetical,5BUX_B,0.6486,0.6664,"3-hydroxyacyl-[acyl-carrier-protein] dehydratase FabZ (E.C.4.2.1.59); FabZ, antimicrobial target, hot-dog fold; HET: GOL; 1.9A {Yersinia pestis KIM10+}",PF14765.7,0.5190,0.3717,PS-DH ; Polyketide synthase dehydratase,5BUY_A,99.49,"3-hydroxyacyl-[acyl-carrier-protein] dehydratase FabZ (E.C.4.2.1.59); FabZ, antimicrobial target, fatty acid; HET: SO4; 2.55A {Francisella tularensis subsp. tularensis (strain SCHU S4 / Schu 4)}"
WP_010939843.1,DVU_RS16715,DVU2573,hypothetical,6S0K_k,0.2832,0.2782,"50S ribosomal protein L2, 50S; Ribosome nascent chain in complex; HET: MG; 3.1A {Escherichia coli}",PF12669.8,0.5414,0.5798,FeoB_associated ; FeoB-associated Cys-rich membrane protein,5MX2_R,88.29,"Photosystem II protein D1 1; Photosynthesis, Metal Cluster, EDTA, Hydroxylamine; HET: LMG, BCR, PL9, LFA, CLA, DGD, PHO, SQD, HEM, LHG; 2.197A {Thermosynechococcus elongatus (strain BP-1)}"
WP_010939849.1,DVU_RS12095,DVU2579,tetratricopeptide repeat protein,3GYZ_A,0.5439,0.6971,"Chaperone protein ipgC; asymmetric homodimer, Tetratricopeptide repeat, TPR; HET: GOL, SO4; 2.15A {Shigella flexneri}",PF15015.7,0.5205,0.2387,"NYD-SP12_N ; Spermatogenesis-associated, N-terminal",5AIO_A,99.33,"TRANSCRIPTION FACTOR TAU 131 KDA; TRANSCRIPTION, TFIIIC, TPRS; 3.148A {SACCHAROMYCES CEREVISIAE}"
WP_010939862.1,DVU_RS12155,DVU2592,hypothetical,3F1I_H,0.4873,0.5276,"Hepatocyte growth factor-regulated tyrosine kinase; HGS, STAM, ESCRT, ubiquitin, MVB; 2.3A {Homo sapiens}",PF12210.9,0.4294,0.4663,Hrs_helical ; Hepatocyte growth factor-regulated tyrosine kinase substrate,5KDO_G,10.50,"Guanine nucleotide-binding protein G(i), alpha-1; Heterotrimeric G protein G protein; HET: GDP; 1.9A {Rattus norvegicus}"
WP_014524532.1,DVU_RS12160,NULL,hypothetical,5JSD_A,0.4858,0.2767,"phiAB6 tailspike; viral tailspike, beta-helix, superhelical trimer; HET: 1GN, 6PZ, GAL, BGC, MLA, ACY; 1.48A {unidentified phage}",PF10359.10,0.3748,0.2955,Fmp27_WPPW ; RNA pol II promoter Fmp27 protein domain,6OV6_A,99.62,"C24 PROTEIN; FIBER, VIRAL ORIGIN, UNKNOWN FUNCTION; 1.82A {Bizionia argentinensis JUB59}"
WP_164562126.1,DVU_RS12165,NULL,hypothetical,4RSJ_A,0.5189,0.3266,Chromosome partition protein Smc; Smc hinge domain with coiled; 3.5A {Pyrococcus furiosus},PF02090.16,0.5326,0.5350,SPAM ; Salmonella surface presentation of antigen gene type M protein,5Z08_D,7.27,"Cenp-I, Cenp-K, Cenp-H; protein complex, kinetochore, centromere, CELL; 2.199A {Chaetomium thermophilum (strain DSM 1495 / CBS 144.50 / IMI 039719)}"
WP_010939865.1,DVU_RS12170,DVU2595,hypothetical,4R9M_A,0.7756,0.7142,"Spermidine N(1)-acetyltransferase (E.C.2.3.1.57); Structural Genomics, NIAID, National Institute; 2.9A {Escherichia coli}",PF02474.16,0.6925,0.6806,NodA ; Nodulation protein A (NodA),4E2A_B,99.40,"Putative acetyltransferase; Alpha Beta, Alpha and Beta; 2.0A {Streptococcus mutans}"
WP_010939868.1,DVU_RS12180,DVU2598,hypothetical,6R21_Q,0.8665,0.7004,"PROTEIN; viral complex, DNA ejection, VIRAL; 3.33A {Enterobacteria phage T7}",PF17212.4,0.8095,0.8812,Tube ; Tail tubular protein,5MU4_A,100.00,"Tail tubular protein A; tail tubular protein, bacteriophage, exopolysaccharide; 1.9A {Klebsiella phage KP32}"
WP_010939869.1,DVU_RS12185,DVU2599,hypothetical,1I6Z_A,0.3277,0.3410,"BAG-FAMILY MOLECULAR CHAPERONE REGULATOR-1; triple helix bundle, CHAPERONE; NMR {Mus musculus} SCOP: a.7.7.1",PF01338.19,0.3029,0.2401,Bac_thur_toxin ; Bacillus thuringiensis toxin,4V2T_K,35.10,"PLEUROTOLYSIN A, PLEUROTOLYSIN B; TRANSPORT PROTEIN, MACPF/CDC SUPERFAMILY, PORE-FORMING; 11.0A {PLEUROTUS OSTREATUS}"
WP_010939870.1,DVU_RS12190,DVU2600,hypothetical,3J4U_K,0.6812,0.6535,"major capsid protein, cementing protein; protein topology, cryoEM, VIRUS; 3.5A {Bordetella phage BPP-1}",PF09342.12,0.5600,0.6266,DUF1986 ; Domain of unknown function (DUF1986),3J4U_L,99.58,"major capsid protein, cementing protein; protein topology, cryoEM, VIRUS; 3.5A {Bordetella phage BPP-1}"
WP_010940670.1,DVU_RS12195,DVU4020,hypothetical,3J40_F,0.9289,0.8460,"gp10, gp7; capsid, accessory protein, VIRUS; 4.5A {Salmonella phage epsilon15}",PF17236.3,0.6286,0.6596,DUF5309 ; Family of unknown function (DUF5309),3J4U_E,100.00,"major capsid protein, cementing protein; protein topology, cryoEM, VIRUS; 3.5A {Bordetella phage BPP-1}"
WP_014524534.1,DVU_RS12200,DVU2602,hypothetical,4BM5_A,0.3563,0.2891,SIMILAR TO CHLOROPLAST INNER MEMBRANE; PROTEIN TRANSPORT; 4.2A {CYANIDIOSCHYZON MEROLAE},PF10474.10,0.3791,0.3969,DUF2451 ; Protein of unknown function C-terminus (DUF2451),5VMR_D,29.20,"Botulinum neurotoxin type B (E.C.3.4.24.69); mini-protein binder, inhibitor, TOXIN; 1.95A {Clostridium botulinum}"
WP_010939872.1,DVU_RS12205,DVU2603,hypothetical,3LXR_F,0.4971,0.3957,"Transforming protein RhoA, IpgB2; IpgB2, RhoA, GTPase, GEF, GEF-GTPase-complex; HET: GDP, SO4; 1.68A {Homo sapiens}",PF15251.7,0.4932,0.2986,DUF4588 ; Domain of unknown function (DUF4588),4L3U_A,14.27,"Uncharacterized protein; PF1209 family protein, DUF 3571; 1.95A {Acinetobacter baumannii}"
WP_010939873.1,DVU_RS12210,DVU2604,head-tail connector protein,6QWP_F,0.8473,0.8796,"Portal protein; viral protein, DNA packaging; 3.4A {Enterobacteria phage T7}",PF16510.6,0.8242,0.7034,P22_portal ; Phage P22-like portal protein,6QWP_C,100.00,"Portal protein; viral protein, DNA packaging; 3.4A {Enterobacteria phage T7}"
WP_011791744.1,DVU_RS12215,NULL,hypothetical,5C3I_D,0.2581,0.2351,"Histone chaperone ASF1A, Histone H3.1; replication, histone, chaperone, ASF1, MCM; 3.5A {Homo sapiens}",PF08178.12,0.2834,0.3100,GnsAB_toxin ; GnsA/GnsB toxin of bacterial toxin-antitoxin system,6PX3_S,45.85,"Histone H3, Histone H4, Ubiquitin-60S; Set2, nucleosome, chromatin, KMT, GENE;{Xenopus laevis}"
WP_010939875.1,DVU_RS12220,DVU2606,hypothetical,5OS9_B,0.4251,0.3716,B3 domain-containing transcription factor NGA1; Transcription factor B3 DNA binding; HET: CME; 1.8A {Arabidopsis thaliana},PF00788.24,0.4284,0.4162,RA ; Ras association (RalGDS/AF-6) domain,4ACV_B,8.94,"PROPHAGE LAMBDALM01, ANTIGEN B; IMMUNE SYSTEM, SURFACE, PHAGE-RELATED; 2.401A {LISTERIA MONOCYTOGENES}"
WP_010939876.1,DVU_RS12225,DVU2607,hypothetical,5Y6F_A,0.6101,0.5041,"Flagellar brake protein YcgR; C-di-GMP binding, Flagellar brake protein; HET: C2E; 2.3A {Escherichia coli (strain K12)}",PF16823.6,0.4862,0.6607,"PilZ_2 ; Atypical PilZ domain, cyclic di-GMP receptor",5KEC_A,97.27,"Flagellar brake protein YcgR; MrkH, K. pneumonia, biofilm, c-di-GMP; 1.949A {Klebsiella pneumoniae}"
WP_014524535.1,DVU_RS12240,DVU2610,hypothetical,3TCV_B,0.6503,0.6644,"GCN5-related N-acetyltransferase (E.C.2.3.1.5); gram negative coccobacillus, brucellosis, acyl; 1.75A {Brucella melitensis biovar Abortus 2308}",PF02474.16,0.5769,0.7214,NodA ; Nodulation protein A (NodA),5IX3_A,99.55,"Diamine N-acetyltransferase (E.C.2.3.1.57); N-acetyltransferase, GNATs, SPEG, Staphylococcus aureus; 1.81A {Staphylococcus aureus}"
WP_010939880.1,DVU_RS12245,DVU2611,hypothetical,3EZK_E,0.8048,0.7292,"DNA packaging protein Gp17; pentameric motor, DNA packaging, Alternative; 34.0A {Bacteriophage T4}",PF05876.13,0.7100,0.6835,Terminase_GpA ; Phage terminase large subunit (GpA),3EZK_B,100.00,"DNA packaging protein Gp17; pentameric motor, DNA packaging, Alternative; 34.0A {Bacteriophage T4}"
WP_014524537.1,DVU_RS12285,DVU2620,hypothetical,3D59_B,0.6366,0.6772,"Platelet-activating factor acetylhydrolase (E.C.3.1.1.47); PLASMA PLATELET-ACTIVATING FACTOR ACETYLHYDROLASE, SECRETED; HET: SO4, ACT; 1.5A {Homo sapiens}",PF03403.14,0.6288,0.6958,"PAF-AH_p_II ; Platelet-activating factor acetylhydrolase, isoform II",5HDF_B,99.83,Hydrolase; Hydrolase; HET: MSE; 2.71A {Streptomyces flocculus}
WP_010939890.1,DVU_RS12290,DVU2621,hypothetical,4B7J_A,0.3626,0.2614,"NEURAMINIDASE; HYDROLASE, NEURAMINIDASE INHIBITOR, NAI, NAIS; HET: G39, NAG; 2.417A {INFLUENZA A VIRUS}",PF00064.19,0.3177,0.2844,Neur ; Neuraminidase,4IPA_C,34.28,"Putative curved DNA-binding protein; MAP, Methionine Aminopeptidase, Ribosome biogenesis; HET: SO4; 2.3A {Chaetomium thermophilum var. thermophilum DSM 1495}"
WP_010939892.1,DVU_RS12295,DVU2623,hypothetical,3JC8_Nj,0.5996,0.3466,"PilA, Type IV-A pilus assembly; motor, pilus, ring, membrane channel; HET: MEA;{Myxococcus xanthus DK 1622}",PF01519.17,0.5112,0.5336,DUF16 ; Protein of unknown function DUF16,3JC8_Oa,90.08,"PilA, Type IV-A pilus assembly; motor, pilus, ring, membrane channel; HET: MEA;{Myxococcus xanthus DK 1622}"
WP_010939895.1,DVU_RS12305,DVU2626,hypothetical,7C7L_A,0.5840,0.1068,"CRISPR-associated protein Cas14a.1/RNA/DNA Complex; Cas12f, Cas14, sgRNA, target DNA; 3.0A {uncultured archaeon}",PF07282.12,0.5878,0.5674,OrfB_Zn_ribbon ; Putative transposase DNA-binding domain,2DS5_B,91.87,"ATP-dependent Clp protease ATP-binding subunit; treble cleft zinc finger, METAL; HET: PG4; 1.5A {Escherichia coli} SCOP: g.39.1.11"
WP_010939896.1,DVU_RS12310,DVU2627,hypothetical,6V4X_A,0.5311,0.4724,"Small nuclear ribonucleoprotein Sm D3; endonuclease, active CPSF73, U7 snRNP;{Homo sapiens}",PF06186.12,0.5578,0.5107,DUF992 ; Protein of unknown function (DUF992),4IMH_B,19.53,"Hemin degrading factor; Heme Transport, Heme Oxygenase, METAL; 1.976A {Pseudomonas aeruginosa}"
WP_010939898.1,DVU_RS12320,DVU2629,hypothetical,6HXO_G,0.3653,0.2858,"ATP-citrate lyase alpha-subunit; ATP citrate lyase, central metabolism; HET: FLC, MES; 1.5A {Chlorobium limicola}",PF03542.17,0.3689,0.2473,Tuberin ; Tuberin,3CJL_A,17.29,"Domain of unknown function; Structural genomics, Joint Center for; 2.2A {Pectobacterium atrosepticum SCRI1043}"
WP_011791730.1,DVU_RS12330,NULL,hypothetical,3EZ9_B,0.6005,0.1876,"ParA; dna binding, winged-hth, partition, BIOSYNTHETIC; 2.8A {Salmonella enterica subsp. enterica serovar Newport str. SL317}",PF12964.8,0.5739,0.5833,DUF3853 ; Protein of unknown function (DUF3853),1Y6U_A,98.77,"Excisionase from transposon Tn916; DNA architectural protein, Tyrosine recombinase; NMR {Enterococcus faecalis}"
WP_010939900.1,DVU_RS12335,DVU2631,hypothetical,4DNI_A,0.6075,0.3343,"Fusion protein of RNA-editing complex; KREPA3, KREPA6, Editosome, Protein/RNA binding; 2.55A {Trypanosoma brucei,Trypanosoma brucei brucei}",PF15489.7,0.5378,0.0767,"CTC1 ; CST, telomere maintenance, complex subunit CTC1",1WOC_C,89.37,"Primosomal replication protein n; Oligonucleotide Binding fold, DNA BINDING; 2.0A {Escherichia coli}"
WP_010939901.1,DVU_RS12340,DVU2632,hypothetical,4YON_A,0.4427,0.1167,"pREX1, Rac1(G12V); Protein binding; 1.95A {Homo sapiens}",PF09380.11,0.4255,0.3809,FERM_C ; FERM C-terminal PH-like domain,3HZ7_A,39.73,"Uncharacterized protein; alpha-beta protein, Structural Genomics, PSI-2; HET: MSE; 2.0A {Desulfitobacterium hafniense}"
WP_010939903.1,DVU_RS12350,DVU2634,hypothetical,6QLZ_A,0.4499,0.4102,E3 ubiquitin-protein ligase MYLIP (E.C.2.3.2.27); E3 LIGASE CHOLESTEROL METABOLISM LDLR; 2.343A {Homo sapiens},PF03531.15,0.5281,0.5099,SSrecog ; Structure-specific recognition protein (SSRP1),5TDY_C,29.39,"Flagellar M-ring protein, Flagellar motor; flagellar motor, switch complex, MOTOR; HET: MSE; 2.105A {Thermotoga maritima}"
WP_010939907.1,DVU_RS12370,DVU2638,hypothetical,4H6Y_B,0.5520,0.4215,"FERM, RhoGEF and pleckstrin domain-containing; FARP1, DH-PH, GEF, guanine nucleotide; 4.09A {Homo sapiens}",PF02738.19,0.4627,0.3449,Ald_Xan_dh_C2 ; Molybdopterin-binding domain of aldehyde dehydrogenase,3F5R_A,45.23,"FACT complex subunit POB3; APC7736, FACT complex (Spt16p-Pob3p), Saccharomyces; 1.7A {Saccharomyces cerevisiae}"
WP_010939909.1,DVU_RS12380,DVU2640,hypothetical,3FO5_A,0.5389,0.5213,"Thioesterase, adipose associated, isoform BFIT2; Orthogonal Bundle, Consortium, LIPID TRANSPORT; HET: 1PE, TCE; 2.0A {Homo sapiens}",PF00603.18,0.4641,0.2246,Flu_PA ; Influenza RNA-dependent RNA polymerase subunit PA,3ZBI_L,78.76,"TRAF PROTEIN, TRAO PROTEIN, TRAN; CELL ADHESION, BACTERIAL SECRETION; 8.5A {ESCHERICHIA COLI}"
WP_010939911.1,DVU_RS12390,DVU2642,hypothetical,2ZZE_B,0.9129,0.1888,"Alanyl-tRNA synthetase (E.C.6.1.1.7); ligase, hydrolase; HET: OCS, MLY; 2.16A {Pyrococcus horikoshii}",PF19020.1,0.5452,0.3439,Ta1207 ; Ta1207 family,3KEW_A,99.93,"DHHA1 domain protein; STRUCTURAL GENOMICS, PSI-2, TRNA SYNTHASE; 2.0A {Clostridium perfringens}"
WP_014524543.1,DVU_RS12420,DVU2650,hypothetical,6PYR_A,0.4548,0.1263,"Phosphatidylinositol 4,5-bisphosphate 3-kinase catalytic subunit; PI3Kdelta kinase, transferase, TRANSFERASE-TRANSFERASE INHIBITOR; HET: P5J; 2.21A {Homo sapiens}",PF02331.16,0.4572,0.3391,P35 ; Apoptosis preventing protein,2EBF_X,40.34,"Dermonecrotic toxin; Pasteurella multocida toxin, Trojan horse-like; HET: TRE; 1.9A {Pasteurella multocida} SCOP: d.3.1.17, c.150.1.2, a.296.1.1"
WP_010939921.1,DVU_RS12425,DVU2652,hypothetical,1P35_A,0.5077,0.3782,"P35, 1,2-ETHANEDIOL; APOPTOSIS, P35, CELL DEATH, BACULOVIRUS; HET: PO4, EDO; 2.2A {Autographa californica nucleopolyhedrovirus} SCOP: b.28.1.1",PF02331.16,0.4993,0.3747,P35 ; Apoptosis preventing protein,2EBF_X,36.99,"Dermonecrotic toxin; Pasteurella multocida toxin, Trojan horse-like; HET: TRE; 1.9A {Pasteurella multocida} SCOP: d.3.1.17, c.150.1.2, a.296.1.1"
WP_010939932.1,DVU_RS12460,DVU2663,hypothetical,6PSY_A,0.8079,0.1073,"eukaryotic lipid flippase Drs2-Cdc50 (E.C.; complex, phospholipid flippase, P-type ATPase; HET: NAG;{Saccharomyces cerevisiae W303}",PF08235.14,0.7542,0.5527,LNS2 ; LNS2 (Lipin/Ned1/Smp2),2NO5_B,99.65,"(S)-2-haloacid dehalogenase IVA (E.C.3.8.1.2); Haloacid dehalogenase, Dehalogenase, HAD Superfamily; HET: SO4, ASL, CNR; 2.6A {Burkholderia cepacia}"
WP_010939945.1,DVU_RS12530,DVU2676,hypothetical,4MCX_C,0.6746,0.5925,"Host inhibition of growth A; bacterial toxins, biofilms, cell metabolism; 2.1A {Proteus vulgaris}",PF06892.12,0.8347,0.4874,Phage_CP76 ; Phage regulatory protein CII (CP76),2K9Q_A,97.02,"uncharacterized protein; all helix, helix-turn-helix, Plasmid, Structural; NMR {Bacteroides thetaiotaomicron}"
WP_010939950.1,DVU_RS12555,DVU2681,hypothetical,5E1L_A,0.5151,0.2017,"Cell division protein ZapC; Z ring, cell division, Cell; 2.15A {Escherichia coli}",PF04969.17,0.4766,0.4247,CS ; CS domain,5LUP_C,30.59,"BLM protein; helicase dimerization alpha-helix motif, STRUCTURAL; HET: PO4; 2.032A {Homo sapiens}"
WP_014524550.1,DVU_RS12580,DVU2687,hypothetical,6ZM6_J,0.6149,0.5145,"28S ribosomal protein S2, mitochondrial; mitochondrion, translation, closed nascent-polypeptide tunnel; HET: SAC, K, GTP, FES, THC, ATP, MG, IAS, AYA; 2.59A {Homo sapiens}",PF06892.12,0.6895,0.6620,Phage_CP76 ; Phage regulatory protein CII (CP76),2K9Q_A,94.06,"uncharacterized protein; all helix, helix-turn-helix, Plasmid, Structural; NMR {Bacteroides thetaiotaomicron}"
WP_014524554.1,DVU_RS12605,DVU2691,hypothetical,2P2U_B,0.6222,0.5901,"Host-nuclease inhibitor protein Gam, putative; STRUCTURAL GENOMICS, UNKNOWN FUNCTION, PSI-2; 2.75A {Desulfovibrio vulgaris} SCOP: h.4.18.1",PF05565.12,0.6316,0.6379,Sipho_Gp157 ; Siphovirus Gp157,5U59_A,71.06,"Designed dimeric coiled coil peptide; designed peptide, synthetic, metal coordination; HET: 7WJ, CIT; 2.2A {N/A}"
WP_010939961.1,DVU_RS12610,DVU2692,hypothetical,6K5X_A,0.5373,0.5272,"UPF0335 protein CCNA_03428; C. crescentus, NAPs, DNA BINDING; 2.086A {Caulobacter vibrioides (strain NA1000 / CB15N)}",PF00505.20,0.5526,0.6012,HMG_box ; HMG (high mobility group) box,5VID_F,82.72,"Botulinum neurotoxin type B (E.C.3.4.24.69); mini-protein binder, inhibitor, TOXIN; 2.75A {Clostridium botulinum}"
WP_010939962.1,DVU_RS12620,DVU2693,hypothetical,2M3L_A,0.5212,0.5345,"Protein E6; Papillomavirus E6 Proteins, HPV, Oncoprotein; HET: ZN; NMR {Human papillomavirus type 51}",PF15250.7,0.4321,0.1116,Raftlin ; Raftlin,1SVD_M,64.37,"ribulose-1,5-bisphosphate carboxylase/oxygenase large subunit (E.C.4.1.1.39); beta-alpha-barrel, LYASE; HET: SO4; 1.8A {Halothiobacillus neapolitanus} SCOP: d.73.1.1"
WP_010939963.1,DVU_RS12630,DVU2694,hypothetical,6R3E_B,0.6651,0.3892,"DNA (cytosine-5)-methyltransferase 3B,DNA (cytosine-5)-methyltransferase 3B; DNMT3B PWWP DOMAIN, HISTONE BINDING; HET: SO4, 96H; 2.269A {Homo sapiens}",PF15057.7,0.6253,0.6945,DUF4537 ; Domain of unknown function (DUF4537),2RE3_A,37.92,"Uncharacterized protein; STRUCTURAL GENOMICS, JOINT CENTER FOR; HET: MSE; 2.5A {Silicibacter pomeroyi DSS-3}"
WP_010939966.1,DVU_RS12645,DVU2697,hypothetical,5KS5_A,0.5566,0.5929,"Eukaryotic elongation factor 2 kinase; TRANSFERASE, eEF2K, SEL1, elongation, TPR; NMR {Homo sapiens}",PF14675.7,0.4917,0.3141,FANCI_S1 ; FANCI solenoid 1,5KS5_A,98.39,"Eukaryotic elongation factor 2 kinase; TRANSFERASE, eEF2K, SEL1, elongation, TPR; NMR {Homo sapiens}"
WP_010939969.1,DVU_RS12660,DVU2700,hypothetical,5WLQ_A,0.3755,0.3363,"Capsid assembly scaffolding protein,Myosin-7; Myosin, Gp7, Coiled-Coil, Eb1, MOTOR; HET: TMO; 3.104A {Bacillus phage phi29}",PF13851.7,0.3944,0.3340,GAS ; Growth-arrest specific micro-tubule binding,4Q4G_X,36.66,"Peptidoglycan endopeptidase RipA (E.C.3.4.-.-); alpha-beta, cell wall hydrolase, HYDROLASE; 0.97A {Mycobacterium tuberculosis}"
WP_014524556.1,DVU_RS12665,DVU2701,hypothetical,1AM9_C,0.4545,0.5217,STEROL REGULATORY ELEMENT BINDING(STRE)/DNA COMPLEX; STEROL REGULATORY ELEMENT BINDING PROTEIN; 2.3A {Homo sapiens} SCOP: a.38.1.1,PF11221.9,0.4476,0.3597,Med21 ; Subunit 21 of Mediator complex,3ZBI_L,94.77,"TRAF PROTEIN, TRAO PROTEIN, TRAN; CELL ADHESION, BACTERIAL SECRETION; 8.5A {ESCHERICHIA COLI}"
WP_010939971.1,DVU_RS12670,DVU2702,hypothetical,5J73_A,0.6308,0.6976,"designed protein 2L4HC2_23; rosetta, de novo design, DE; 2.56A {synthetic construct}",PF07028.12,0.6679,0.5919,DUF1319 ; Protein of unknown function (DUF1319),3JC8_Oa,88.95,"PilA, Type IV-A pilus assembly; motor, pilus, ring, membrane channel; HET: MEA;{Myxococcus xanthus DK 1622}"
WP_010939972.1,DVU_RS12675,DVU2703,hypothetical,4W7Z_C,0.5922,0.6332,"BAP29; Coiled coil, nanomaterial, transport protein; HET: SO4; 2.2A {Homo sapiens}",PF10779.10,0.6500,0.6886,XhlA ; Haemolysin XhlA,2XZR_A,85.02,"IMMUNOGLOBULIN-BINDING PROTEIN EIBD; CELL ADHESION, TRIMERIC AUTOTRANSPORTER ADHESIN; 2.8A {ENTEROBACTERIA PHAGE P-EIBD}"
WP_010940676.1,DVU_RS12705,DVU4026,hypothetical,7AE6_B,0.6940,0.7760,"HEPN toxin; toxin-antitoxin system, MNT-HEPN, AMPylation, TOXIN; HET: EDO, AMP; 1.65A {Aphanizomenon flos-aquae 2012/KM1/D3}",PF18737.2,0.6110,0.5124,HEPN_MAE_28990 ; MAE_28990/MAE_18760-like HEPN,3C8G_A,95.78,"Putative transcriptional regulator; APC27974, YggD, Mannitol operon repressor; HET: MSE, MLY; 2.5A {Shigella flexneri 2a str. 2457T} SCOP: a.285.1.1"
WP_010939980.1,DVU_RS12720,DVU2712,hypothetical,2OUT_A,0.5001,0.4319,"Mu-like prophage FluMu protein gp35; structural genomics, Haemophilus influenzae, hypothetical; NMR {Haemophilus influenzae} SCOP: d.344.1.1, a.140.3.2",PF17891.2,0.4311,0.8006,FluMu_N ; Mu-like prophage FluMu N-terminal domain,2OUT_A,98.81,"Mu-like prophage FluMu protein gp35; structural genomics, Haemophilus influenzae, hypothetical; NMR {Haemophilus influenzae} SCOP: d.344.1.1, a.140.3.2"
WP_010939985.1,DVU_RS12745,DVU2717,hypothetical,5YJJ_B,0.5318,0.2548,"Polyribonucleotide nucleotidyltransferase (E.C.2.7.7.8); polynucleotidyl phosphorylase, RNA degradation, Polyadenylation; HET: PO4; 2.2A {Staphylococcus epidermidis (strain ATCC 12228)}",PF05544.12,0.4476,0.3983,Pro_racemase ; Proline racemase,6G6F_D,60.86,"CC-Type2-LF; de novo, coiled coil, alpha-helical; HET: ACE; 1.7A {N/A}"
WP_010939987.1,DVU_RS12750,DVU2719,hypothetical,6RAP_A,0.6648,0.5799,"Afp1, Afp2, Afp3, Afp16; Anti-feeding prophage, secretion system, AFP; 3.3A {Serratia entomophila}",PF10618.10,0.8412,0.9011,Tail_tube ; Phage tail tube protein,3HNW_B,38.07,"uncharacterized protein; coiled-coil, Structural Genomics, PSI-2, Protein; HET: MSE, GOL; 2.196A {Eubacterium eligens}"
WP_010939988.1,DVU_RS12755,DVU2720,hypothetical,3KLU_A,0.6347,0.4822,"Uncharacterized protein yqbN; NESG, STRUCTURAL GENOMICS, PSI-2,PROTEIN STRUCTURE; 2.2A {Bacillus subtilis}",PF16459.6,0.6499,0.6273,"Phage_TAC_13 ; Phage tail assembly chaperone, TAC",2OB9_B,54.91,"Tail assembly chaperone; Bacteriophage HK97, morphogenesis, tail assembly; HET: MSE; 2.3A {Enterobacteria phage HK97}"
WP_010939990.1,DVU_RS12765,DVU2722,DNA circularization N-terminal domain-containing protein,5UE8_A,0.4998,0.2887,"Protein unc-13 homolog A; ALPHA HELICAL, NEUROTRANSMITTER RELEASE, SNARE; 3.35A {Rattus norvegicus}",PF15292.7,0.4232,0.2943,Treslin_N ; Treslin N-terminus,6J0N_f,93.19,"Pvc1, Pvc9, Pvc11, Pvc12, Pvc4; assembly, Photorhabdus asymbiotica, PVC, contractile; 3.5A {Photorhabdus asymbiotica subsp. asymbiotica (strain ATCC 43949 / 3105-77)}"
WP_010939993.1,DVU_RS12780,DVU2725,hypothetical,1ISE_A,0.4661,0.4086,Ribosome Recycling Factor; Translation; 2.2A {Escherichia coli} SCOP: d.67.3.1,PF03245.14,0.3899,0.3996,Phage_lysis ; Bacteriophage Rz lysis protein,3A0B_x,69.10,"Photosystem Q(B) protein, Photosystem II; MULTI-MEMBRANE PROTEIN COMPLEX, Electron transport; HET: OEC, PQ9, LHG, CLA, BCR, HEM, PHO, MGE, DGD; 3.7A {Thermosynechococcus vulcanus}"
WP_010939994.1,DVU_RS12785,DVU2727,phage GP46 family protein,2IA7_A,0.8773,0.7824,"Crystal structure of putative tail; NP_952040.1, putative tail lysozyme, Structural; 1.44A {Geobacter sulfurreducens} SCOP: d.373.1.1",PF10934.9,0.7102,0.7613,DUF2634 ; Protein of unknown function (DUF2634),6U5K_B,99.68,"Sheath PA0622, Glue PA0627, Tri1a; bacteriocin, pyocin, ANTIMICROBIAL PROTEIN; 3.5A {Pseudomonas aeruginosa (strain ATCC 15692 / DSM 22644 / CIP 104116 / JCM 14847 / LMG 12228 / 1C / PRS 101 / PAO1)}"
WP_010940672.1,DVU_RS12825,DVU4022,hypothetical,4XHP_A,0.5510,0.2791,"ParM hybrid fusion protein; STRUCTURAL PROTEIN, BACTERIAL ACTIN-LIKE PROTEIN; HET: ADP; 3.2A {Bacillus thuringiensis serovar kurstaki str. YBT-1520}",PF08735.11,0.6833,0.9278,DUF1786 ; Putative pyruvate format-lyase activating enzyme (DUF1786),6BQW_F,80.27,"Bacterial actin AlfA; actin, plasmid segregation, filament, CYTOSOLIC; HET: ANP; 4.2A {Bacillus subtilis}"
WP_010940012.1,DVU_RS12880,DVU2746,hypothetical,6R77_A,0.7915,0.6840,"Proline racemase; trans-3-Hydroxy-L-proline dehydratase, lyase, hydro-lyase, hydroxyproline; HET: HY3; 2.0A {Thermococcus litoralis}",PF05544.12,0.7554,0.7206,Pro_racemase ; Proline racemase,6JIW_A,99.95,"Diaminopimelate epimerase; histidine racemase, cobalt and nickel; HET: MSE; 1.58A {Staphylococcus aureus}"
WP_010940013.1,DVU_RS12885,DVU2747,hypothetical,6F38_n,0.4886,0.3793,"ARP1 actin related protein 1; TDH, DDH, Complex, dynein/dynactin/HOOK3, MOTOR; HET: ATP, ADP;{Sus scrofa}",PF11573.9,0.4782,0.4143,Med23 ; Mediator complex subunit 23,3O0F_A,99.79,"putative metal-dependent phosphoesterase; STRUCTURAL GENOMICS, JOINT CENTER FOR; HET: AMP; 1.94A {Bifidobacterium adolescentis}"
WP_011791684.1,DVU_RS12945,DVU2760,hypothetical,6YII_A,0.6658,0.4084,"Transcriptional regulator; ATP Complex, Class III adenylyl; HET: ATP, SO4; 1.44A {Pseudomonas aeruginosa}",PF00211.21,0.5716,0.8882,Guanylate_cyc ; Adenylate and Guanylate cyclase catalytic domain,5X4T_A,99.70,"Photoactivated adenylyl cyclase; cAMP, BLUF domain, optogenetics, photoactivation; HET: FMN; 1.601A {Cyanobacteria}"
WP_010940027.1,DVU_RS12950,DVU2761,hypothetical,2F66_A,0.4669,0.4579,"Vps23C, Vps28N, Vps37C; Endosome, Trafficking complex, Vps23, Vps28; HET: SO4; 2.8A {Saccharomyces cerevisiae} SCOP: a.2.17.1",PF14145.7,0.4591,0.4681,YrhK ; YrhK-like protein,6DXR_B,54.73,"Apolipoprotein C-I; lipoprotein particles, lipids, alpha helix; HET: MPD; 2.0A {Homo sapiens}"
WP_010940032.1,DVU_RS16720,DVU2766,hypothetical,3HZ7_A,0.6695,0.4790,"Uncharacterized protein; alpha-beta protein, Structural Genomics, PSI-2; HET: MSE; 2.0A {Desulfitobacterium hafniense}",PF17797.2,0.7084,0.5858,RL ; RL domain,3CP8_A,15.03,"tRNA uridine 5-carboxymethylaminomethyl modification enzyme; Rossmann fold, FAD-binding domain, dinucleotide-binding; HET: FAD; 3.2A {Chlorobium tepidum}"
WP_010940044.1,DVU_RS13020,DVU2778,hypothetical,4OX0_B,0.6670,0.6048,"Developmental protein SEPALLATA 3; coiled-coil, oligomerization domain, keratin-like domain; 2.49A {Arabidopsis thaliana}",PF14968.7,0.6521,0.2321,CCDC84 ; Coiled coil protein 84,5J0J_C,83.86,"designed protein 2L6HC3_6; rosetta, de novo design, DE; 2.256A {synthetic construct}"
WP_014524569.1,DVU_RS13035,DVU2781,hypothetical,3NKU_A,0.4197,0.3692,"DrrA; POSTTRANSLATIONAL MODIFICATION, AMPYLATION, ADENYLYLATION, RAB1B; HET: PGE, MSE; 2.1A {Legionella pneumophila subsp. pneumophila}",PF05266.15,0.3931,0.3767,DUF724 ; Protein of unknown function (DUF724),1O5H_A,16.00,"formiminotetrahydrofolate cyclodeaminase; TM1560, Formiminotetrahydrofolate cyclodeaminase, STRUCTURAL GENOMICS; 2.8A {Thermotoga maritima} SCOP: a.191.1.1"
