,locus_tag,old_locus_tag,OctoberProduct,SAdLSApdb,SAdLSApreTMS,SAdLSApreTMS2,SAdLSApdbDescription,pfamID,pfamPreTMS,pfamPreTMS2,pfamDescription,hhblitsID,hhblitsProb,hhblitsDescription
WP_010939009.1,DVU_RS08180,DVU1721,head-tail connector protein,6QWP_F,0.8712,0.8757,"Portal protein; viral protein, DNA packaging; 3.4A {Enterobacteria phage T7}",PF12236.9,0.8440,0.9480,Head-tail_con ; Bacteriophage head to tail connecting protein,6QWP_C,100.00,"Portal protein; viral protein, DNA packaging; 3.4A {Enterobacteria phage T7}"
WP_010939010.1,DVU_RS08185,DVU1722,hypothetical,1RZ2_A,0.2949,0.1985,"conserved hypothetical protein; Sortase B protein, B. anthracis; 1.6A {Bacillus anthracis} SCOP: b.100.1.1",PF12017.9,0.3067,0.2193,Tnp_P_element ; Transposase protein,6PX3_S,73.12,"Histone H3, Histone H4, Ubiquitin-60S; Set2, nucleosome, chromatin, KMT, GENE;{Xenopus laevis}"
WP_010939011.1,DVU_RS08190,DVU1723,hypothetical,3TCV_B,0.8369,0.6414,"GCN5-related N-acetyltransferase (E.C.2.3.1.5); gram negative coccobacillus, brucellosis, acyl; 1.75A {Brucella melitensis biovar Abortus 2308}",PF11124.9,0.7291,0.5088,Pho86 ; Inorganic phosphate transporter Pho86,6E1X_D,99.74,"Ornithine aminotransferase, mitochondrial (E.C.2.6.1.13); SpeG, polyamine, GNAT, N-acetyltransferase, Structural; HET: TRS, MPD, SPM, HLG, MRD, SP5; 1.35A {Vibrio cholerae serotype O1 (strain ATCC 39315 / El Tor Inaba N16961)}"
WP_010939012.1,DVU_RS08195,DVU1724,hypothetical,3EZK_E,0.7717,0.7180,"DNA packaging protein Gp17; pentameric motor, DNA packaging, Alternative; 34.0A {Bacteriophage T4}",PF05876.13,0.6981,0.6898,Terminase_GpA ; Phage terminase large subunit (GpA),3EZK_B,100.00,"DNA packaging protein Gp17; pentameric motor, DNA packaging, Alternative; 34.0A {Bacteriophage T4}"
WP_010939013.1,DVU_RS08200,DVU1725,hypothetical,4DZP_B,0.5990,0.8295,"Gene 1 protein; gp1, DNA-binding, R48A mutation, VIRAL; 1.8A {Shigella phage Sf6}",PF07141.12,0.6487,0.7370,Phage_term_sma ; Putative bacteriophage terminase small subunit,4DYQ_B,99.55,"Gene 1 protein; gp1, octamer, DNA-binding, VIRAL PROTEIN; 1.502A {Shigella phage Sf6}"
WP_010939014.1,DVU_RS08205,DVU1726,hypothetical,2QA7_C,0.6494,0.5124,"Huntingtin-interacting protein 1; HIPPI-binding, Huntington's disease, apoptosis, coiled-coil; 2.8A {Homo sapiens}",PF07439.12,0.6283,0.5036,DUF1515 ; Protein of unknown function (DUF1515),3CI9_A,91.67,"Heat shock factor-binding protein 1; triple helix, Nucleus, TRANSCRIPTION; 1.8A {Homo sapiens}"
WP_010939015.1,DVU_RS08210,DVU1727,hypothetical,1L0M_A,0.4523,0.3136,"bacteriorhodopsin; Bacteriorhodopsin, alternative method for structure; NMR {N/A} SCOP: f.13.1.1",PF11351.9,0.5976,0.6151,"GTA_holin_3TM ; Holin of 3TMs, for gene-transfer release",3BBZ_A,53.09,"P protein; molten globule, VIRAL PROTEIN, REPLICATION; HET: FMT; 2.1A {Mumps virus}"
WP_010939016.1,DVU_RS08215,DVU1728,hypothetical,4KT3_A,0.4242,0.3576,"Uncharacterized protein, Putative lipoprotein; Glycoside hydrolase, Hydrolase, PFL_3036; 1.4362A {Pseudomonas protegens}",PF12763.8,0.3883,0.4645,EF-hand_4 ; Cytoskeletal-regulatory complex EF hand,2O8K_A,33.20,"RNA POLYMERASE SIGMA FACTOR RPON/DNA; PROTEIN-DNA COMPLEX, HELIX-TURN-HELIX, TRANSCRIPTION FACTOR; NMR {Aquifex aeolicus}"
WP_014524399.1,DVU_RS08230,NULL,hypothetical,7JLU_A,0.5218,0.5034,"Disease resistance protein Roq1 (E.C.3.2.2.6); Resistosome, Plant Immunity, Effector, LRR;{Nicotiana benthamiana}",PF11573.9,0.4311,0.4328,Med23 ; Mediator complex subunit 23,3PFI_A,98.60,Holliday junction ATP-dependent DNA helicase; Probable Holliday Junction DNA Helicase; HET: ADP; 2.695A {Campylobacter jejuni subsp. jejuni}
WP_010939023.1,DVU_RS08235,DVU1735,BrnT family toxin,3U97_A,0.7485,0.3439,Ribonuclease toxin BrnT (E.C.3.1.27.1); RNAse Sa/RelE small ribonuclease fold; 1.102A {Brucella abortus},PF04365.14,0.6539,0.4205,"BrnT_toxin ; Ribonuclease toxin, BrnT, of type II toxin-antitoxin system",3U97_A,99.03,Ribonuclease toxin BrnT (E.C.3.1.27.1); RNAse Sa/RelE small ribonuclease fold; 1.102A {Brucella abortus}
WP_010939024.1,DVU_RS08240,DVU1736,hypothetical,2LPE_A,0.3878,0.2235,"Kinase suppressor of Ras 1; SAM DOMAIN, CC-SAM, COILED-COIL, SIGNALING; NMR {Mus musculus}",PF07647.18,0.3308,0.3289,SAM_2 ; SAM domain (Sterile alpha motif),2E6X_C,13.18,"Hypothetical protein TTHA1281; unknown function protein, NPPSFA, National; HET: MSE; 2.0A {Thermus thermophilus}"
WP_010939025.1,DVU_RS08245,DVU1737,hypothetical,1Y6U_A,0.6935,0.7092,"Excisionase from transposon Tn916; DNA architectural protein, Tyrosine recombinase; NMR {Enterococcus faecalis}",PF09035.11,0.7018,0.7265,Tn916-Xis ; Excisionase from transposon Tn916,1Y6U_A,99.19,"Excisionase from transposon Tn916; DNA architectural protein, Tyrosine recombinase; NMR {Enterococcus faecalis}"
WP_164928130.1,DVU_RS08260,DVU1739,hypothetical,2B9K_A,0.5592,0.4524,"Antimicrobial peptide LCI; BETA-STRANDED PROTEIN, AMP, ANTIBIOTIC; NMR {Bacillus subtilis}",PF12197.9,0.5700,0.4698,lci ; Bacillus cereus group antimicrobial protein,2B9K_A,44.01,"Antimicrobial peptide LCI; BETA-STRANDED PROTEIN, AMP, ANTIBIOTIC; NMR {Bacillus subtilis}"
WP_081448125.1,DVU_RS08265,NULL,hypothetical,1J7K_A,0.4422,0.2251,"HOLLIDAY JUNCTION DNA HELICASE RUVB; AAA+-Class ATPase, Winged-Helix Domain, DNA; HET: ATP; 1.8A {Thermotoga maritima} SCOP: c.37.1.20, a.4.5.11",PF16872.6,0.5413,0.7653,putAbiC ; Putative phage abortive infection protein,4YKC_A,22.30,Malcavernin; adaptor protein; HET: MSE; 2.7A {Homo sapiens}
WP_010939028.1,DVU_RS08270,DVU1740,hypothetical,1NO1_A,0.6514,0.6803,replisome organizer; helical bipartite natively; HET: MSE; 2.4A {Bacillus phage SPP1} SCOP: a.179.1.1,PF06992.12,0.5680,0.4860,Phage_lambda_P ; Replication protein P,1NO1_C,99.36,replisome organizer; helical  bipartite  natively; HET: MSE; 2.4A {Bacillus phage SPP1} SCOP: a.179.1.1
WP_010939029.1,DVU_RS08275,DVU1741,hypothetical,6IG5_D,0.3744,0.2991,"Argininosuccinate lyase (E.C.4.3.2.1); argininosuccinate lyase, fumarate, tetrameric structure; 2.078A {Mycobacterium tuberculosis (strain ATCC 25618 / H37Rv)}",PF15799.6,0.3458,0.2572,CCD48 ; Coiled-coil domain-containing protein 48,4AYB_Q,1.84,"DNA-DIRECTED RNA POLYMERASE (E.C.2.7.7.6); TRANSFERASE, MULTI-SUBUNIT, TRANSCRIPTION; HET: ZN; 3.202A {SULFOLOBUS SHIBATAE}"
WP_164561408.1,DVU_RS08285,DVU1743,hypothetical,4Y66_C,0.5513,0.4546,"Mnd1, Putative tbpip family protein; cell cycle; 3.2A {Giardia lamblia ATCC 50803}",PF06892.12,0.7764,0.7678,Phage_CP76 ; Phage regulatory protein CII (CP76),2OG0_B,87.84,"Excisionase/DNA Complex; PROTEIN-DNA COMPLEX, DNA ARCHITECTURAL PROTEIN; 1.9A {Enterobacteria phage lambda} SCOP: a.6.1.7"
WP_014524394.1,DVU_RS08310,DVU1748,hypothetical,5U89_A,0.4781,0.3130,"Amino acid adenylation domain protein; nonribosomal peptide synthetase, MbtH-like protein; HET: MJ8; 3.075A {Geobacillus sp.}",PF00604.18,0.3979,0.3422,Flu_PB2 ; Influenza RNA-dependent RNA polymerase subunit PB2,2VYC_C,40.32,"BIODEGRADATIVE ARGININE DECARBOXYLASE (E.C.4.1.1.19); ARGININE DECARBOXYLASE, PYRIDOXAL PHOSPHATE, PLP-DEPENDENT; HET: PLP; 2.4A {ESCHERICHIA COLI}"
WP_014524392.1,DVU_RS08320,NULL,hypothetical,2CF7_E,0.5963,0.4357,"DPR; PEROXIDE RESISTANCE, DPS-FAMILY, FERRITIN-LIKE, FERROXIDASE; HET: EPE; 1.5A {STREPTOCOCCUS SUIS}",PF01865.17,0.5480,0.3548,PhoU_div ; Protein of unknown function DUF47,1K1F_B,7.07,"BREAKPOINT CLUSTER REGION PROTEIN (E.C.2.7.1.-); Oligomerization, coiled coil, Bcr-Abl kinase; HET: MSE; 2.2A {Homo sapiens} SCOP: a.147.1.1"
WP_010939040.1,DVU_RS08325,DVU1752,hypothetical,1YSM_A,0.5024,0.5114,"Calcyclin-binding protein; helix-turn-helix, Metal Binding Protein; NMR {Mus musculus} SCOP: a.2.16.1",PF01627.24,0.5375,0.4498,Hpt ; Hpt domain,3FF5_A,36.08,"Peroxisomal biogenesis factor 14; protein import, peroxin, 3 helices; HET: DPW; 1.8A {Rattus norvegicus}"
WP_014524391.1,DVU_RS08330,NULL,hypothetical,1NLW_A,0.5529,0.4477,"MAD PROTEIN/MAX PROTEIN/DNA; transcription factor, DNA, bHLHZ, TRANSCRIPTION-DNA; 2.0A {Homo sapiens} SCOP: a.38.1.1",PF00571.29,0.4605,0.4667,CBS ; CBS domain,1LXN_A,23.84,"HYPOTHETICAL PROTEIN MTH1187; HYPOTHETICAL STRUCTURE, STRUCTURAL GENOMICS, PSI; HET: SO4, MSE; 2.3A {Methanothermobacter thermautotrophicus} SCOP: d.58.48.1"
WP_010939042.1,DVU_RS08335,DVU1754,helix-turn-helix domain-containing protein,3R1F_P,0.6771,0.6771,"ESX-1 secretion-associated regulator EspR; helix-turn-helix, transcription factor, helix-turn-helix transcription; HET: MSE; 2.5A {Mycobacterium tuberculosis}",PF06892.12,0.5751,0.5094,Phage_CP76 ; Phage regulatory protein CII (CP76),2KPJ_A,98.82,"SOS-response transcriptional repressor, LexA; NESG, GFT, Structural Genomics, PSI-2; NMR {Eubacterium rectale ATCC 33656}"
WP_010939043.1,DVU_RS08340,DVU1755,hypothetical,1JOC_A,0.5249,0.4091,"Early Endosomal Autoantigen 1; FYVE domain, inositol 3-phosphate binding; HET: ITP; 2.2A {Homo sapiens} SCOP: g.50.1.1, h.1.21.1",PF07295.12,0.4776,0.3315,DUF1451 ; Zinc-ribbon containing domain,5M3K_B,86.78,"PhlA, 2,4-diacetylphloroglucinol biosynthesis protein PhlB; acyltransferase, Pseudomonas protegens, PhlABC, multi-component; HET: SCY; 2.83A {Pseudomonas fluorescens}"
WP_014524389.1,DVU_RS08345,NULL,hypothetical,2QL8_A,0.5324,0.3410,"Putative redox protein; Structural genomics, Joint Center for; HET: BEZ, EDO, MSE; 1.5A {Lactobacillus casei}",PF14552.7,0.4464,0.4435,Tautomerase_2 ; Tautomerase enzyme,3FP9_A,55.53,"Proteasome-associated ATPase; five strand beta barrel, hexamer; 2.0A {Mycobacterium tuberculosis}"
WP_010939044.1,DVU_RS08350,DVU1756,hypothetical,6PIJ_J,0.7212,0.2094,"cas7 type I-F CRISPR-associated protein; CRISPR/Cas, Cascade, RNA BINDING PROTEIN; 2.9A {Vibrio cholerae}",PF12964.8,0.7196,0.6654,DUF3853 ; Protein of unknown function (DUF3853),1Z4H_A,98.95,"Tor inhibition protein; winged helix, reverse turn, PROTEIN; NMR {Escherichia coli}"
WP_010939062.1,DVU_RS08425,DVU1774,hypothetical,5Y6F_A,0.7487,0.8480,"Flagellar brake protein YcgR; C-di-GMP binding, Flagellar brake protein; HET: C2E; 2.3A {Escherichia coli (strain K12)}",PF17659.2,0.5595,0.2353,DUF5521 ; Family of unknown function (DUF5521),5KEC_A,99.83,"Flagellar brake protein YcgR; MrkH, K. pneumonia, biofilm, c-di-GMP; 1.949A {Klebsiella pneumoniae}"
WP_010939082.1,DVU_RS08510,DVU1794,hypothetical,6GQN_B,0.3747,0.3854,"Cell cycle protein GpsB, PBP1A; Bacterial cell division regulator, peptidoglycan; HET: SO4; 1.8A {Streptococcus pneumoniae R6}",PF16360.6,0.3258,0.2941,GTP-bdg_M ; GTP-binding GTPase Middle Region,2MFR_A,86.18,"Insulin receptor (E.C.2.7.10.1); insulin recepotr, membrane protein, detergent; NMR {Homo sapiens}"
WP_010940655.1,DVU_RS08535,DVU4005,hypothetical,6AN0_A,0.8012,0.5843,"Histidinol dehydrogenase (E.C.1.1.1.23); SSGCID, Elizabethkingia anophelis NUHP1, dehydrogenase; HET: HIS, IOD, EDO; 1.85A {Elizabethkingia anophelis NUHP1}",PF00815.21,0.7634,0.6063,Histidinol_dh ; Histidinol dehydrogenase,4G07_A,100.00,"Histidinol dehydrogenase (E.C.1.1.1.23); Rossmann Fold, L-HISTIDINOL DEHYDROGENASE, OXIDOREDUCTASE; 1.95A {Brucella suis 1330}"
WP_150103619.1,DVU_RS08540,NULL,hypothetical,2M6O_A,0.5339,0.6688,"Uncharacterized protein; RbpA, RNAP, Sigma factor, TRANSCRIPTION; NMR {Streptomyces coelicolor}",PF06676.12,0.5249,0.2864,DUF1178 ; Protein of unknown function (DUF1178),4C2M_B,35.96,"DNA-DIRECTED RNA POLYMERASES I, II; TRANSCRIPTION, RIBOSOME BIOGENESIS; HET: SO4, ZN; 2.8A {SACCHAROMYCES CEREVISIAE}"
WP_014524383.1,DVU_RS08545,DVU1801,hypothetical,5XZC_A,0.4403,0.3252,"Histone acetyltransferase p300 (E.C.2.3.1.48), p53; transcription factor, autoacetylation, allosteric interaction; 10.7A {Homo sapiens}",PF09481.11,0.3872,0.3377,CRISPR_Cse1 ; CRISPR-associated protein Cse1 (CRISPR_cse1),2HEQ_A,78.28,"YorP protein; SH3-like, BSU2030, YorP, NESG, Structural; NMR {Bacillus subtilis} SCOP: b.34.20.1"
WP_010939108.1,DVU_RS08645,DVU1821,hypothetical,2VDC_F,0.7897,0.1515,"GLUTAMATE SYNTHASE [NADPH] LARGE CHAIN; OXIDOREDUCTASE, AMIDOTRANSFERASE, AMMONIA ASSIMILATION, NADP; HET: OMT, F3S, FMN, FAD, AKG, SF4; 9.5A {AZOSPIRILLUM BRASILENSE} SCOP: d.153.1.1, b.80.4.1, c.1.4.1",PF01493.20,0.5647,0.7136,GXGXG ; GXGXG motif,2VDC_A,100.00,"GLUTAMATE SYNTHASE [NADPH] LARGE CHAIN; OXIDOREDUCTASE, AMIDOTRANSFERASE, AMMONIA ASSIMILATION, NADP; HET: FAD, F3S, SF4, FMN, OMT, AKG; 9.5A {AZOSPIRILLUM BRASILENSE} SCOP: b.80.4.1, d.153.1.1, c.1.4.1"
WP_010939113.1,DVU_RS08670,DVU1826,PxxKW family cysteine-rich protein,6Y17_C,0.4650,0.4910,"Nuclear receptor corepressor 1,B-cell lymphoma; BCL6, NCoR1., TRANSCRIPTION; 1.56A {Homo sapiens}",PF18718.2,0.3439,0.3164,CxC5 ; CxC5 like cysteine cluster associated with KDZ transposases,4V9F_1,32.80,"PROTEIN/RNA Complex; 50S ribosomal subunit, ribonucleoprotein, ribosomal; HET: CL, MG, PSU, OMG, UR3, ACY, 1MA, NA, OMU; 2.404A {Haloarcula marismortui}"
WP_010939117.1,DVU_RS08685,DVU1830,hypothetical,5Y6F_A,0.6218,0.8436,"Flagellar brake protein YcgR; C-di-GMP binding, Flagellar brake protein; HET: C2E; 2.3A {Escherichia coli (strain K12)}",PF07095.12,0.4727,0.2836,IgaA ; Intracellular growth attenuator protein IgaA,5KEC_A,99.79,"Flagellar brake protein YcgR; MrkH, K. pneumonia, biofilm, c-di-GMP; 1.949A {Klebsiella pneumoniae}"
WP_010939131.1,DVU_RS08755,DVU1845,hypothetical,2LD3_A,0.7090,0.7211,"Myosin VI; molecular motor, myosin VI, lever; NMR {Mus musculus}",PF03623.14,0.6980,0.5143,Focal_AT ; Focal adhesion targeting region,5GNP_A,49.15,"Cell division protein ZapD; ZapD, cytokinesis, cell division, FtsZ; 2.8A {Salmonella typhimurium (strain LT2 / SGSC1412 / ATCC 700720)}"
WP_010939139.1,DVU_RS08795,DVU1853,hypothetical,3VJF_B,0.5296,0.5145,"WA20; PROTEIN DESIGN, DE NOVO PROTEIN; HET: MSE; 2.2A {synthetic construct}",PF15458.7,0.4673,0.1889,NTR2 ; Nineteen complex-related protein 2,5LO4_A,85.17,"PPa-CH3; Designed miniprotein CH-pi interactions weak; HET: 4PH, ACE, NH2; NMR {N/A}"
WP_014524380.1,DVU_RS08800,DVU1854,hypothetical,1DE4_G,0.4662,0.3810,"HEMOCHROMATOSIS PROTEIN/BETA-2-MICROGLOBULIN/TRANSFERRIN RECEPTOR; HFE, HEREDITARY HEMOCHROMATOSIS, MHC CLASS; HET: NAG; 2.8A {Homo sapiens} SCOP: b.1.1.2, d.19.1.1",PF16226.6,0.4851,0.3453,DUF4885 ; Domain of unknown function (DUF4885),3KGK_B,69.12,"Arsenical resistance operon trans-acting repressor; alpha+beta, Arsenical resistance, Chaperone, DNA-binding; 1.4A {Escherichia coli}"
WP_010939151.1,DVU_RS16705,DVU1865,hypothetical,2Z1A_A,0.4514,0.0723,"5'-nucleotidase (E.C.3.1.3.5); nucleotidase, Metal-binding, Nucleotide-binding, Hydrolase, Structural; HET: THM; 1.75A {Thermus thermophilus} SCOP: d.114.1.1, d.159.1.2",PF02495.18,0.3247,0.3099,TGBp3 ; Triple gene block 3,2Z1A_A,70.75,"5'-nucleotidase (E.C.3.1.3.5); nucleotidase, Metal-binding, Nucleotide-binding, Hydrolase, Structural; HET: THM; 1.75A {Thermus thermophilus} SCOP: d.114.1.1, d.159.1.2"
WP_010939152.1,DVU_RS08850,DVU1866,hypothetical,3GVE_A,0.8569,0.6051,"YfkN protein; alpha-beta-beta-alpha sandwich, Structural Genomics, PSI-2; HET: CIT, MSE; 1.25A {Bacillus subtilis subsp. subtilis}",PF13277.7,0.7468,0.6993,YmdB ; YmdB-like protein,5H7W_B,99.87,"venom 5'-nucleotidase; 5'-nucleotidase, purine hydrolysis, snake venom; HET: NAG, BMA; 1.9A {Naja atra}"
WP_010939166.1,DVU_RS08915,DVU1880,hypothetical,2X9Q_B,0.4274,0.3517,CYCLODIPEPTIDE SYNTHETASE; LIGASE; HET: MSE; 2.02A {MYCOBACTERIUM TUBERCULOSIS},PF16715.6,0.4713,0.4698,CDPS ; Cyclodipeptide synthase,3KTB_A,67.24,"Arsenical resistance operon trans-acting repressor; alpha-beta-alpha sandwich, helix-turn-helix, Structural Genomics; HET: GOL; 2.1A {Bacteroides vulgatus}"
WP_010939173.1,DVU_RS08950,DVU1887,hypothetical,1XFI_A,0.5279,0.8096,"protein; STRUCTURAL GENOMICS, PROTEIN STRUCTURE INITIATIVE; 1.7A {Arabidopsis thaliana} SCOP: e.50.1.1",PF14314.7,0.4505,0.3987,Methyltrans_Mon ; Virus-capping methyltransferase,2Q40_A,100.00,"Protein At2g17340; Ensemble Refinement, Refinement Methodology Development; HET: MG; 1.7A {Arabidopsis thaliana} SCOP: e.50.1.1"
WP_010939180.1,DVU_RS08990,DVU1894,hypothetical,2D9K_A,0.5829,0.5659,"FLN29 gene product; FLN29, zinc finger, zf-TRAF, Structural; HET: ZN; NMR {Homo sapiens}",PF05129.14,0.5485,0.5149,Elf1 ; Transcription elongation factor Elf1 like,1VD4_A,98.36,"Transcription initiation factor IIE, alpha; ZINC FINGER, Transcription; HET: ZN; NMR {Homo sapiens} SCOP: g.41.3.1"
WP_011792157.1,DVU_RS09045,NULL,hypothetical,2D8D_A,0.4897,0.4378,"phospho-2-dehydro-3-deoxyheptonate aldolase/chorismate mutase(E.C.5.4.99.5); Chorismate, Dimer, Structural Genomics, NPPSFA; 1.15A {Thermus thermophilus} SCOP: a.130.1.1",PF17376.3,0.4780,0.4594,DUF5398 ; Family of unknown function (DUF5398),6MEZ_B,34.30,"Bacteriochlorophyll a protein; FMO Photosynthesis Antenna complex, Energy; HET: BCL, SO4; 1.74A {Prosthecochloris aestuarii}"
WP_010939229.1,DVU_RS09210,DVU1943,hypothetical,3ON0_D,0.4288,0.3221,"TraM/DNA complex; DNA binding protein, DNA Protein-DNA; 2.874A {Escherichia coli}",PF15553.7,0.3877,0.2404,TEX19 ; Testis-expressed protein 19,4LPZ_D,36.88,"Aryl hydrocarbon receptor nuclear translocator; PAS domain coiled coil, transcription; 3.15A {Homo sapiens}"
WP_010939234.1,DVU_RS09235,DVU1948,hypothetical,3HIE_C,0.6392,0.4027,"Exocyst complex component SEC3; PH domain, dimer, domain swapping; HET: PO4; 2.0A {Saccharomyces cerevisiae}",PF08416.14,0.6186,0.4949,PTB ; Phosphotyrosine-binding domain,6DG6_E,27.64,"neoleukin-2/15; cytokine mimetic, BIOSYNTHETIC PROTEIN; 1.999A {synthetic construct}"
WP_010939241.1,DVU_RS09270,DVU1955,hypothetical,5A7D_B,0.7103,0.5479,"PINS, INSCUTEABLE; CELL CYCLE, LGN, INSCUTEABLE, ASYMMETRIC; 3.4A {DROSOPHILA MELANOGASTER}",PF16918.6,0.6742,0.5605,PknG_TPR ; Protein kinase G tetratricopeptide repeat,1N94_A,99.90,"Protein farnesyltransferase alpha subunit (E.C.2.5.1.-); Farnesyltransferase, Prenyltransferase, TRANSFERASE; HET: HFP, TIN; 3.5A {Rattus norvegicus} SCOP: a.118.6.1"
WP_014524365.1,DVU_RS09305,NULL,hypothetical,1NLW_A,0.3510,0.3564,"MAD PROTEIN/MAX PROTEIN/DNA; transcription factor, DNA, bHLHZ, TRANSCRIPTION-DNA; 2.0A {Homo sapiens} SCOP: a.38.1.1",PF15409.7,0.3669,0.3580,PH_8 ; Pleckstrin homology domain,4B2U_A,8.73,"S67; TOXIN, SPIDER VENOM PEPTIDE, ICK; NMR {SICARIUS DOLICHOCEPHALUS}"
WP_010939266.1,DVU_RS09375,DVU1980,hypothetical,2B0H_A,0.6507,0.6243,"Talin-1; talin, vinculin, helical bundle, VBS; NMR {Mus musculus} SCOP: a.24.9.2",PF00489.18,0.5749,0.4435,IL6 ; Interleukin-6/G-CSF/MGF family,2KRU_A,36.14,"Light-independent protochlorophyllide reductase subunit B; NESG, PSI, bchB, Bacteriochlorophyll biosynthesis; NMR {Chlorobaculum tepidum}"
WP_010939276.1,DVU_RS09420,DVU1990,hypothetical,2P3P_A,0.6881,0.7115,"Hypothetical protein; MCSG, hypothetical protein, MAD, PSI-2; HET: MSE; 1.76A {Porphyromonas gingivalis W83} SCOP: d.383.1.1",PF11644.9,0.6364,0.7049,DUF3256 ; Protein of unknown function (DUF3256),2P3P_B,100.00,"Hypothetical protein; MCSG, hypothetical protein, MAD, PSI-2; 1.76A {Porphyromonas gingivalis W83} SCOP: d.383.1.1"
WP_010939277.1,DVU_RS09430,DVU1991,hypothetical,5FB9_A,0.4421,0.5168,"Nuclease S1 (E.C.3.1.30.1); Endonuclease, Zinc dependent, hydrolase; HET: BTB, NAG; 1.5A {Aspergillus oryzae RIB40}",PF02265.17,0.4471,0.5435,S1-P1_nuclease ; S1/P1 Nuclease,5VID_F,24.43,"Botulinum neurotoxin type B (E.C.3.4.24.69); mini-protein binder, inhibitor, TOXIN; 2.75A {Clostridium botulinum}"
WP_164928132.1,DVU_RS09465,NULL,hypothetical,5J0N_F,0.6103,0.2885,"Integrase, Integration host factor subunit; bacteriophage lambda, excision, site-specific recombination; 11.0A {Enterobacteria phage lambda}",PF15165.7,0.5177,0.3783,REC114-like ; Meiotic recombination protein REC114-like,3JU0_A,98.87,"Phage integrase; four stranded beta-sheet, DNA BINDING; 1.6A {Pectobacterium atrosepticum}"
WP_010939290.1,DVU_RS09485,DVU2006,(2Fe-2S)-binding protein,2HU9_A,0.6853,0.3209,"Mercuric transport protein periplasmic component; copper chaperone, iron-sufur protein, CopZ; 1.78A {Archaeoglobus fulgidus}",PF17806.2,0.7226,0.4709,SO_alpha_A3 ; Sarcosine oxidase A3 domain,2HU9_A,99.22,"Mercuric transport protein periplasmic component; copper chaperone, iron-sufur protein, CopZ; 1.78A {Archaeoglobus fulgidus}"
WP_010939305.1,DVU_RS09555,DVU2023,hypothetical,4ETX_A,0.4802,0.3352,"PelD; c-di-GMP, SIGNALING PROTEIN; 2.0A {Pseudomonas aeruginosa}",PF18474.2,0.4779,0.4152,DUF5614 ; Family of unknown function (DUF5614),3FOV_A,84.18,"UPF0102 protein RPA0323; structural genomics, APC7380, PSI-2, Protein; 1.88A {Rhodopseudomonas palustris}"
WP_010939313.1,DVU_RS09600,DVU2033,hypothetical,5EAN_A,0.5795,0.2605,"DNA replication ATP-dependent helicase/nuclease DNA2/DNA; DNA binding protein, Hydrolase-DNA complex; HET: ADP; 2.36A {Mus musculus}",PF10926.9,0.6095,0.6874,DUF2800 ; Protein of unknown function (DUF2800),3SM4_C,99.54,"Exonuclease (E.C.3.1.11.3)/DNA complex; homologous recombination, DNA repair, recombineering; HET: PO4; 1.88A {Enterobacteria phage lambda}"
WP_010939314.1,DVU_RS09605,DVU2034,hypothetical,2WNY_A,0.5105,0.4621,"CONSERVED PROTEIN MTH689; UNKNOWN FUNCTION, EXOSOME SUPEROPERON; 1.95A {METHANOTHERMOBACTER THERMAUTOTROPHICUS}",PF15600.7,0.5197,0.3778,Imm64 ; Immunity protein 64,2KRX_A,20.90,"Asl3597 protein; Structural Genomics, PSI-2, Protein Structure; NMR {Nostoc sp.}"
WP_010939319.1,DVU_RS09625,DVU2039,hypothetical,4HRV_B,0.5402,0.3580,"Putative lipoprotein GNA1162; DUF799, LIPID BINDING PROTEIN; 1.89A {Neisseria meningitidis}",PF12112.9,0.5194,0.5343,DUF3579 ; Protein of unknown function (DUF3579),5BNF_B,26.20,"Uncharacterized protein; ADP-hydrolase, ADP-cyclase, calcium signalling, cADPR; 2.3A {Sus scrofa}"
WP_010939320.1,DVU_RS09630,DVU2040,hypothetical,1BRT_A,0.7791,0.3071,"BROMOPEROXIDASE A2; HALOPEROXIDASE, OXIDOREDUCTASE, PEROXIDASE, ALPHA/BETA HYDROLASE; 1.5A {Streptomyces aureofaciens} SCOP: c.69.1.12",PF06342.13,0.7456,0.2828,DUF1057 ; Alpha/beta hydrolase of unknown function (DUF1057),1ILO_A,17.01,"conserved hypothetical protein MtH895; beta-alpha-beta-alpha-beta-beta-alpha motif, Structural Genomics, PSI; NMR {Methanothermobacter thermautotrophicus str. Delta H} SCOP: c.47.1.1"
WP_010939323.1,DVU_RS09645,DVU2043,hypothetical,1YVR_A,0.4865,0.4831,"60-kDa SS-A/Ro ribonucleoprotein/RNA complex; HEAT repeat von Willebrand; 1.95A {Xenopus laevis} SCOP: a.118.25.1, c.62.1.5",PF11443.9,0.5003,0.4225,DUF2828 ; Domain of unknown function (DUF2828),6QT8_A,99.29,"Midasin; ribosome biogenesis, integrin, midas, RIBOSOME; HET: GOL, SO4; 2.33A {Chaetomium thermophilum var. thermophilum DSM 1495}"
WP_010939325.1,DVU_RS09650,DVU2045,hypothetical,1TAF_A,0.3808,0.3568,"TFIID TBP ASSOCIATED FACTOR 42; TRANSCRIPTION INITIATION, HISTONE FOLD, COMPLEX; 2.0A {Drosophila melanogaster} SCOP: a.22.1.3",PF07524.14,0.3602,0.3297,Bromo_TP ; Bromodomain associated,2VR0_F,75.79,"CYTOCHROME C NITRITE REDUCTASE, CATALYTIC; QUINOL DEHYDROGENASE, OXIDOREDUCTASE, HQNO, NRFH; HET: HEM, HQO; 2.8A {DESULFOVIBRIO VULGARIS}"
WP_014524452.1,DVU_RS09660,NULL,hypothetical,3UCS_A,0.5719,0.5640,"Chaperone-modulator protein CbpM, Curved DNA-binding; protein-protein complex, Structural Genomics, Montreal-Kingston; 1.87A {Klebsiella pneumoniae}",PF04645.13,0.5913,0.3838,"DUF603 ; Protein of unknown function, DUF603",1Z4H_A,98.88,"Tor inhibition protein; winged helix, reverse turn, PROTEIN; NMR {Escherichia coli}"
WP_010939329.1,DVU_RS09670,DVU2051,hypothetical,5OQM_l,0.4697,0.3244,"Mediator of RNA polymerase II; transcription initiation, TRANSCRIPTION, macromolecular complex; HET: ZN; 5.8A {Saccharomyces cerevisiae (strain ATCC 204508 / S288c)}",PF15146.7,0.4365,0.4311,FANCAA ; Fanconi anemia-associated,2DSY_B,50.80,"Hypothetical protein TTHA0281; STRUCTURAL GENOMICS, THERMUS THERMOPHILUS HB8; HET: MSE, NHE; 1.9A {Thermus thermophilus} SCOP: d.304.1.2"
WP_010939335.1,DVU_RS09695,DVU2057,hypothetical,6Y50_q,0.3770,0.2869,"Splicing factor 3A subunit 3; 17S U2 snRNP, SPLICING; 4.1A {Homo sapiens}",PF12877.8,0.3702,0.2934,DUF3827 ; Domain of unknown function (DUF3827),6QBK_A,35.83,"Big defensin 1; Big-defensin, antimicrobial, marine, oyster, ANTIMICROBIAL; HET: AAR; NMR {N/A}"
WP_010940661.1,DVU_RS09745,DVU4011,hypothetical,3TMB_B,0.6159,0.2465,"Uncharacterized protein Bd1817; HD-GYP, phosphodiesterase, UNKNOWN FUNCTION, HYDROLASE,SIGNALING; HET: PO4; 1.7A {Bdellovibrio bacteriovorus}",PF11871.9,0.5343,0.4673,DUF3391 ; Domain of unknown function (DUF3391),3TM8_A,97.13,"Uncharacterized protein; HD-GYP, phosphodiesterase, UNKNOWN FUNCTION, HYDROLASE; HET: PO4, DMS; 1.28A {Bdellovibrio bacteriovorus}"
WP_010939349.1,DVU_RS09760,DVU2071,hypothetical,5IR6_A,0.8421,0.6158,"Bd-type quinol oxidase subunit I; bd oxidase, terminal oxidase, oxidoreductase; HET: HDD, HEB; 3.8A {Geobacillus stearothermophilus K1041}",PF01654.18,0.8333,0.6233,Cyt_bd_oxida_I ; Cytochrome bd terminal oxidase subunit I,6RX4_A,100.00,"Cytochrome bd-I ubiquinol oxidase subunit; BD OXIDASE, TERMINAL OXIDASE, OXIDOREDUCTASE; HET: PEE, UQ8, HDD, HEB; 3.3A {Escherichia coli (strain K12)}"
WP_014524456.1,DVU_RS09810,NULL,hypothetical,3BPQ_A,0.4397,0.4244,"Antitoxin RelB3, Toxin RelE3 (E.C.3.1.-.-); protein toxin-antitoxin complex, TOXIN; 2.2A {Methanocaldococcus jannaschii}",PF02402.17,0.5007,0.4842,Lysis_col ; Lysis protein,5OK8_A,71.59,LPP20 lipoprotein; Virulence factor  Helicobacter pylori; HET: EPE; 1.874A {Helicobacter pylori (strain J99 / ATCC 700824)}
WP_010940668.1,DVU_RS09815,DVU4018,hypothetical,6PFJ_T,0.5208,0.3899,"AmfC protein, RNA polymerase sigma; sigma, anti-sigma, c-di-GMP, developmental switch; HET: C2E; 2.08A {Streptomyces venezuelae (strain ATCC 10712 / CBS 650.69 / DSM 40230 / JCM 4526 / NBRC 13096 / PD 04745)}",PF02656.16,0.5660,0.8187,DUF202 ; Domain of unknown function (DUF202),2M67_A,53.36,"MerF; integral membrane protein, mercury transporter; NMR {Morganella morganii}"
